{
  "$schema": "https://json-schema.org/draft/2020-12/schema",
  "$id": "https://github.com/agentsec-ecosystem/agentwatch/schema/agent-record.schema.json",
  "title": "agentwatch record",
  "description": "A normalized agent activity record (tool call / behavior span).",
  "type": "object",
  "required": ["schema_version", "session_id", "agent", "tool", "outcome", "started_at"],
  "properties": {
    "schema_version": { "type": "string", "const": "0.1.0" },
    "session_id": { "type": "string" },
    "trace_id": { "type": "string" },
    "span_id": { "type": "string" },
    "parent_span_id": { "type": ["string", "null"] },
    "harness": { "type": "string", "examples": ["claude-code", "cursor", "langgraph", "python"] },
    "project": { "type": ["string", "null"], "description": "Project working directory (M9 per-project filtering)" },
    "host": { "type": ["string", "null"], "description": "Originating host tag for fleet aggregation (M11 R13)" },
    "parent_session_id": { "type": ["string", "null"], "description": "Logical parent session for resumed/forked sessions (M9)" },
    "producer": {
      "type": "object",
      "description": "Record provenance (M15 S26). Optional for backward compatibility: records written before this field are read as an inferred kind 'hook'. New records should set it.",
      "required": ["kind"],
      "properties": {
        "kind": { "enum": ["hook", "import", "event", "ingest", "proxy", "sdk", "demo"] },
        "name": { "type": "string" },
        "version": { "type": "string" }
      },
      "additionalProperties": false
    },
    "agent": {
      "type": "object",
      "required": ["identity"],
      "properties": {
        "identity": { "type": "string" },
        "name": { "type": "string" },
        "version": { "type": "string" },
        "prompt_version": { "type": "string" },
        "model_version": { "type": "string" },
        "tool_schema_version": { "type": "string" },
        "workload_type": { "type": "string" }
      }
    },
    "tool": {
      "type": "object",
      "required": ["name"],
      "properties": {
        "name": { "type": "string" },
        "server": { "type": ["string", "null"], "description": "MCP server, if any" },
        "arguments": { "type": ["object", "null"], "description": "Redacted per privacy mode" },
        "response": { "type": ["object", "null"], "description": "Redacted tool result per privacy mode" },
        "privacy_mode": { "enum": ["metadata-only", "truncated", "hashed", "full"] }
      }
    },
    "outcome": { "enum": ["ok", "error", "denied"] },
    "started_at": { "type": "string", "format": "date-time" },
    "ended_at": { "type": ["string", "null"], "format": "date-time" },
    "duration_ms": { "type": ["number", "null"] },
    "tokens": { "type": ["integer", "null"] },
    "cost_usd": { "type": ["number", "null"] },
    "step_type": { "enum": ["reason", "act", "observe", "verify", null] },
    "approval": {
      "enum": ["user", "auto", "not-required", "denied", "unknown", null],
      "description": "Who authorized the call (M19 S14). Absent on legacy records and read as 'unknown'."
    },
    "environment": {
      "type": ["object", "null"],
      "description": "Metadata-only session-start snapshot: VCS revision, OS principal, harness/OS (M19 S16/S29). No env-var values."
    },
    "truncated": {
      "type": ["object", "null"],
      "description": "Visible truncation marker when a pathological record exceeded a limit (M21 S36): {fields:[{field, original_bytes, rule}], record_bytes?}. Never a silent shortening."
    },
    "security_event": { "$ref": "security-event.schema.json" }
  },
  "additionalProperties": false
}
