{
  "schema_version": "0.1.0",
  "session_id": "sess-producer",
  "agent": { "identity": "agent-1" },
  "tool": { "name": "Bash" },
  "outcome": "ok",
  "started_at": "2026-01-02T03:04:05+00:00",
  "harness": "claude-code",
  "producer": { "kind": "hook", "name": "claude-code", "version": "0.1.0" }
}
